title,url,published,updated
MatR: Paul McCartney and Bruce Springsteen: The End,/2024/07/06/matr-paul-mccartney-and-bruce-springsteen-the-end/,2024-07-06T15:30:00-07:00,2024-07-06T15:26:19-07:00
Roll of the Dice: Water Station,/2023/12/24/roll-of-the-dice-water-station/,2023-12-24T05:30:00-08:00,2024-01-03T16:41:46-08:00
MatR: Paul McCartney and Bruce Springsteen: I Wanna Be Your Man,/2023/07/15/matr-paul-mccartney-and-bruce-springsteen-i-wanna-be-your-man/,2023-07-15T05:30:00-07:00,2023-07-15T05:03:15-07:00
"MatR: Bruce Springsteen, Joe Grushecky, and Gary U.S. Bonds: The Twist",/2023/02/25/matr-bruce-springsteen-joe-grushecky-and-gary-u-s-bonds-the-twist/,2023-02-25T05:00:00-08:00,2024-01-03T16:32:46-08:00
MatR: Bruce Springsteen and John Fogerty: Bad Moon Rising,/2023/01/18/matr-bruce-springsteen-and-john-fogerty-bad-moon-rising/,2023-01-18T05:30:00-08:00,2024-01-03T16:28:27-08:00
"MatR: Bruce Springsteen, The Indigo Girls, Arlo Guthrie, and more: Hard Travelin’",/2022/12/23/matr-bruce-springsteen-the-indigo-girls-arlo-gu/,2022-12-23T05:00:00-08:00,2022-12-23T06:53:30-08:00
MatR: Eddie Vedder and Bruce Springsteen: Better Man,/2022/11/10/matr-eddie-vedder-and-bruce-springsteen-better-man/,2022-11-10T05:00:00-08:00,2022-11-10T06:13:00-08:00
"MatR: Mary Wilson, The Drifters, Billy Joel, Bruce Springsteen and more: Stop! In the Name of Love",/2022/11/03/matr-mary-wilson-the-drifters-billy-joel-bruce-/,2022-11-03T05:00:00-07:00,2024-01-03T16:17:54-08:00
"MatR: The Temptations, The Wallflowers, and Bruce Springsteen: My Girl",/2022/10/26/matr-the-temptations-the-wallflowers-and-bruce-springsteen-my-girl/,2022-10-26T05:30:00-07:00,2024-01-03T16:16:02-08:00
MatR: Patti Smith and Bruce Springsteen: My Car Was Invisible (The Case of Bruce Springsteen),/2022/10/20/matr-patti-smith-and-bruce-springsteen-my-car-w/,2022-10-20T05:00:00-07:00,2022-10-20T05:14:09-07:00
MatR: Bruce Springsteen and The Shots: Farther Up the Road,/2021/04/06/matr-bruce-springsteen-and-the-shots-farther-up-the-road/,2021-04-06T05:00:00-07:00,2021-04-05T05:30:10-07:00
"MatR: Roy Orbison, Bruce Springsteen and Friends: (All I Can Do Is) Dream You",/2021/04/03/matr-roy-orbison-bruce-springsteen-and-friends-/,2021-04-03T05:00:00-07:00,2021-04-02T16:28:47-07:00
Cover Me: Knock on Wood,/2021/04/02/cover-me-knock-on-wood/,2021-04-02T05:00:00-07:00,2021-04-02T05:19:26-07:00
MatR: Bruce Springsteen and Cats on a Smooth Surface: Hound Dog,/2021/03/30/matr-bruce-springsteen-and-cats-on-a-smooth-surface-hound-dog/,2021-03-30T05:00:00-07:00,2021-03-30T05:40:07-07:00
MatR: Jackson Browne and Bruce Springsteen: Running on Empty,/2021/03/24/matr-jackson-browne-and-bruce-springsteen-running-on-empty/,2021-03-24T05:00:00-07:00,2021-03-23T18:53:50-07:00
MatR: Solar Circus and Bruce Springsteen: Stems and Seeds,/2021/03/22/matr-solar-circus-and-bruce-springsteen-stems-and-seeds/,2021-03-22T05:00:00-07:00,2021-03-21T19:27:50-07:00
"MatR: Little Steven, Bruce Springsteen and the Asbury Park All-Star Revue: Little by Little",/2021/03/19/matr-little-steven-bruce-springsteen-and-the-as/,2021-03-19T05:00:00-07:00,2021-03-18T18:13:14-07:00
MatR: Billy Joel and Bruce Springsteen: Allentown,/2021/03/16/matr-billy-joel-and-bruce-springsteen-allentown/,2021-03-16T05:00:00-07:00,2021-03-14T16:35:09-07:00
MatR: John Mellencamp and Bruce Springsteen: Pink Houses,/2021/03/11/matr-john-mellancamp-and-bruce-springsteen-pink-houses/,2021-03-11T05:00:00-08:00,2023-01-02T17:33:50-08:00
MatR: Bruce Springsteen and Bobby Bandiera: Willie and the Hand Jive,/2021/02/22/matr-bruce-springsteen-and-bobby-bandiera-willie-and-the-hand-jive/,2021-02-22T05:00:00-08:00,2021-02-22T04:50:12-08:00
MatR: Little Steven and Bruce Springsteen: Men Without Women,/2021/02/20/matr-little-steven-and-bruce-springsteen-men-without-women/,2021-02-20T05:00:00-08:00,2021-02-20T06:16:11-08:00
"MatR: Tina Turner, Bruce Springsteen, Little Richard, Stevie Wonder, and more: River Deep – Mountain High",/2021/02/18/matr-tina-turner-bruce-springsteen-little-richa/,2021-02-18T05:00:00-08:00,2021-02-13T15:57:11-08:00
MatR: Patti Scialfa and Bruce Springsteen: Love (Stand Up),/2021/02/14/matr-patti-scialfa-and-bruce-springsteen-love-stand-up/,2021-02-14T05:00:00-08:00,2021-02-13T22:28:05-08:00
"MatR: Tom Petty & The Heartbreakers, Bruce Springsteen, and Bob Dylan: I’m Cryin’",/2021/02/03/matr-bruce-springsteen-bob-dylan-and-tom-petty-/,2021-02-03T05:00:00-08:00,2023-01-02T17:16:21-08:00
"RotD/Cover Me, Gary U.S. Bonds: Hold On (To What You Got)",/2021/01/28/cover-me-gary-u-s-bonds-hold-on-to-what-you-got/,2021-01-28T05:00:00-08:00,2023-01-02T17:19:32-08:00
MatR: Jersey Artists for Mankind (featuring Bruce Springsteen): We’ve Got the Love,/2021/01/25/matr-jersey-artists-for-mankind-featuring-bruce/,2021-01-25T05:00:00-08:00,2021-01-25T04:44:16-08:00
MatR: Joe Grushecky and Bruce Springsteen: A Good Life,/2021/01/21/matr-joe-grushecky-and-bruce-springsteen-a-good-life/,2021-01-21T05:00:00-08:00,2021-01-21T05:37:02-08:00
MatR: Jesse Malin and Bruce Springsteen: Meet Me at the End of the World,/2021/01/14/matr-jesse-malin-and-bruce-springsteen-meet-me-/,2021-01-14T05:00:00-08:00,2021-01-13T19:08:58-08:00
MatR: Joe Grushecky and Bruce Springsteen: Billy’s Waltz,/2021/01/09/matr-joe-grushecky-and-bruce-springsteen-billys-waltz/,2021-01-09T05:00:00-08:00,2021-12-21T11:25:23-08:00
MatR: R.E.M. and Bruce Springsteen: Man on the Moon,/2021/01/06/matr-r-e-m-and-bruce-springsteen-man-on-the-moon/,2021-01-06T05:00:00-08:00,2021-01-05T21:29:06-08:00
MatR: Wilson Pickett and Bruce Springsteen: In the Midnight Hour,/2020/12/31/matr-wilson-pickett-and-bruce-springsteen-in-the-midnight-hour/,2020-12-31T05:00:00-08:00,2020-12-31T05:55:26-08:00
MatR: John Fogerty and Bruce Springsteen: When Will I Be Loved,/2020/12/28/matr-john-fogerty-and-bruce-springsteen-when-will-i-be-loved/,2020-12-28T05:00:00-08:00,2020-12-28T05:16:34-08:00
MatR: Patti Smith and Bruce Springsteen: Land,/2020/12/23/matr-patti-smith-and-bruce-springsteen-land/,2020-12-23T05:00:00-08:00,2020-12-22T20:21:33-08:00
"MatR: Bruce Springsteen, Sting, Lady Gaga, Elton John, and more: Don’t Stop Believin’",/2020/12/20/matr-bruce-springsteen-sting-lady-gaga-elton-jo/,2020-12-20T05:00:00-08:00,2020-12-20T05:26:22-08:00
MatR: Patti Scialfa and Bruce Springsteen: Valerie,/2020/12/13/matr-patti-scialfa-and-bruce-springsteen-valerie/,2020-12-13T05:00:00-08:00,2020-12-12T22:35:32-08:00
MatR: Joe Grushecky and Bruce Springsteen: American Babylon,/2020/12/11/matr-joe-grushecky-and-bruce-springsteen-american-babylon/,2020-12-11T05:00:00-08:00,2021-12-21T06:42:10-08:00
MatR: Steve Earle and Bruce Springsteen: Guitar Town,/2020/11/28/matr-steve-earle-and-bruce-springsteen-guitar-town/,2020-11-28T05:00:00-08:00,2020-11-28T14:35:26-08:00
Cover Me: Down the Road Apiece,/2020/11/25/cover-me-down-the-road-apiece/,2020-11-25T05:00:00-08:00,2023-01-01T18:35:28-08:00
"MatR: Paul McCartney, Billy Joel, Bruce Springsteen and more: Let It Be",/2020/11/23/matr-paul-mccartney-billy-joel-bruce-springsteen-and-more-let-it-be/,2020-11-23T05:00:00-08:00,2020-11-23T05:52:11-08:00
"MatR: Elvis Costello, Bruce Springsteen, and Nils Lofgren: Black Ladder",/2020/11/16/matr-elvis-costello-bruce-springsteen-and-nils-lofgren-black-ladder/,2020-11-16T05:00:00-08:00,2020-11-16T05:23:09-08:00
"MatR: Neil Young, Bruce Springsteen, and Nils Lofgren: Helpless",/2020/11/11/matr-neil-young-bruce-springsteen-and-nils-lofgren-helpless/,2020-11-11T05:00:00-08:00,2020-11-11T16:38:19-08:00
MatR: Elvis Costello and Bruce Springsteen: Alison,/2020/11/08/matr-elvis-costello-and-bruce-springsteen-alison/,2020-11-08T05:00:00-08:00,2021-12-20T22:00:26-08:00
MatR: Billy Joel and Bruce Springsteen: The River of Dreams,/2020/10/27/matr-billy-joel-and-bruce-springsteen-the-river-of-dreams/,2020-10-27T05:00:00-07:00,2021-12-20T18:20:04-08:00
Spare Parts: Warren Zevon: Jeannie Needs a Shooter,/2020/10/23/spare-parts-warren-zevon-jeannie-needs-a-shooter/,2020-10-23T05:00:00-07:00,2020-10-23T05:04:50-07:00
American Babylon: A Retrospective,/2020/10/17/american-babylon-a-retrospective/,2020-10-17T05:00:00-07:00,2024-01-02T13:47:10-08:00
MatR: Bruce Springsteen and Pete Seeger: Hobo’s Lullaby,/2020/10/15/matr-bruce-springsteen-and-pete-seeger-hobos-lullaby/,2020-10-15T05:00:00-07:00,2020-10-14T14:02:36-07:00
MatR: Patti Scialfa and Bruce Springsteen: Play It As It Lays,/2020/10/12/matr-patti-scialfa-and-bruce-springsteen-play-it-as-it-lays/,2020-10-12T05:00:00-07:00,2020-10-12T05:15:39-07:00
"MatR: Roy Orbison, Bruce Springsteen and Friends: Uptown",/2020/10/06/matr-roy-orbison-bruce-springsteen-and-friends-uptown/,2020-10-06T05:00:00-07:00,2020-10-05T20:29:37-07:00
MatR: U2 and Bruce Springsteen: Where the Streets Have No Name,/2020/10/02/matr-u2-and-bruce-springsteen-where-the-streets-have-no-name/,2020-10-02T05:00:00-07:00,2021-12-20T18:06:40-08:00
MatR: Patti Scialfa and Bruce Springsteen: Children’s Song,/2020/09/20/matr-patti-scialfa-and-bruce-springsteen-childrens-song/,2020-09-20T05:00:00-07:00,2024-01-02T13:33:41-08:00
MatR: The Patti Smith Group and Bruce Springsteen: We’re Gonna Have a Real Good Time Together,/2020/09/09/matr-the-patti-smith-group-and-bruce-springstee/,2020-09-09T05:00:00-07:00,2020-09-09T06:01:25-07:00
MatR: Jesse Malin and Bruce Springsteen: Wendy,/2020/09/05/matr-jesse-malin-and-bruce-springsteen-wendy/,2020-09-05T05:00:00-07:00,2020-09-04T20:07:25-07:00
MatR: Alejandro Escovedo and Bruce Springsteen: Always a Friend,/2020/08/31/matr-alejandro-escovedo-and-bruce-springsteen-always-a-friend/,2020-08-31T05:00:00-07:00,2020-12-26T09:01:48-08:00
"MatR: Southside Johnny, Little Steven, and Bruce Springsteen: All I Needed Was You",/2020/08/28/matr-southside-johnny-little-steven-and-bruce-s/,2020-08-28T05:00:00-07:00,2020-08-27T15:57:46-07:00
"MatR: Roy Orbison, Bruce Springsteen and Friends: Running Scared",/2020/08/24/matr-roy-orbison-bruce-springsteen-and-friends-running-scared/,2020-08-24T05:00:00-07:00,2020-08-24T05:16:35-07:00
MatR: Bruce Springsteen and Sam Moore: I Thank You,/2020/08/20/matr-bruce-springsteen-and-sam-moore-i-thank-you/,2020-08-20T05:00:00-07:00,2023-01-01T16:02:31-08:00
"MatR: Dion, Bruce Springsteen, Paul Simon, Lou Reed, James Taylor, Billy Joel, and Reuben Blades: A Teenager in Love",/2020/08/16/matr-dion-bruce-springsteen-paul-simon-lou-reed/,2020-08-16T05:00:00-07:00,2020-08-15T22:03:29-07:00
"MatR: Bruce Springsteen, Neil Young, and Exit 105: All Along the Watchtower",/2020/08/13/matr-bruce-springsteen-neil-young-and-exit-105-/,2020-08-13T05:00:00-07:00,2020-08-13T06:00:34-07:00
MatR: Marah and Bruce Springsteen: Float Away,/2020/08/11/matr-marah-and-bruce-springsteen-float-away/,2020-08-11T05:00:00-07:00,2020-08-11T05:46:44-07:00
MatR: Patti Scialfa and Bruce Springsteen: Town Called Heartbreak,/2020/08/09/matr-patti-scialfa-and-bruce-springsteen-town-called-heartbreak/,2020-08-09T05:00:00-07:00,2020-08-09T05:57:29-07:00
"MatR: Prince, Bruce Springsteen, and Madonna: Baby I’m a Star",/2020/08/07/matr-prince-bruce-springsteen-and-madonna-baby-im-a-star/,2020-08-07T05:00:00-07:00,2020-08-06T09:28:17-07:00
"MatR: Pete Seeger, Bruce Springsteen, and Friends: Well May the World Go",/2020/08/03/matr-pete-seeger-bruce-springsteen-and-friends-/,2020-08-03T05:00:00-07:00,2020-08-03T05:43:46-07:00
MatR: Ringo Starr’s All-Starr Band and Bruce Springsteen: Get Back,/2020/07/22/matr-ringo-starr-and-bruce-springsteen-get-back/,2020-07-22T05:00:00-07:00,2020-07-22T05:45:12-07:00
MatR: Bruce Springsteen and just about everybody: Mustang Sally,/2020/07/15/matr-bruce-springsteen-and-just-about-everybody-mustang-sally/,2020-07-15T05:00:00-07:00,2020-07-15T05:24:57-07:00
MatR: John Fogerty and Bruce Springsteen: Deja Vu (All Over Again),/2020/07/11/matr-john-fogerty-and-bruce-springsteen-deja-vu-all-over-again/,2020-07-11T05:00:00-07:00,2024-01-02T12:56:14-08:00
MatR: Joe Grushecky and Bruce Springsteen: East Carson Street,/2020/07/02/matr-joe-grushecky-and-bruce-springsteen-east-carson-street/,2020-07-02T05:00:00-07:00,2020-07-02T04:49:23-07:00
MatR: Bruce Springsteen and Mike Ness: Bad Luck,/2020/06/25/matr-bruce-springsteen-and-mike-ness-bad-luck/,2020-06-25T05:00:00-07:00,2020-06-25T05:21:46-07:00
Cover Me: Not Fade Away,/2020/06/24/cover-me-not-fade-away/,2020-06-24T05:00:00-07:00,2021-12-20T08:47:49-08:00
MatR: Patti Scialfa and Bruce Springsteen: Rainy Day Man,/2020/06/18/matr-patti-scialfa-and-bruce-springsteen-rainy-day-man/,2020-06-18T05:00:00-07:00,2023-01-01T15:34:38-08:00
MatR: Joe Grushecky and Bruce Springsteen: Talking to the King,/2020/06/12/matr-joe-grushecky-and-bruce-springsteen-talking-to-the-king/,2020-06-12T05:00:00-07:00,2020-12-24T08:49:25-08:00
MatR: Warren Zevon and Bruce Springsteen: Disorder in the House,/2020/06/08/matr-warren-zevon-and-bruce-springsteen-disorder-in-the-house/,2020-06-08T05:00:00-07:00,2023-01-01T15:26:06-08:00
MatR: Terence Trent D’Arby and Bruce Springsteen: I Have Faith in These Desolate Times,/2020/06/02/matr-terence-trent-darby-and-bruce-springsteen-/,2020-06-02T05:00:00-07:00,2020-06-02T04:52:26-07:00
MatR: Michael Strollo and Bruce Springsteen: Could Die Young Tonight,/2020/06/01/matr-michael-strollo-and-bruce-springsteen-could-die-young-tonight/,2020-06-01T05:00:00-07:00,2020-06-01T05:09:49-07:00
MatR: Patti Scialfa and Bruce Springsteen: Spanish Dancer,/2020/05/28/matr-patti-scialfa-and-bruce-springsteen-spanish-dancer/,2020-05-28T05:00:00-07:00,2020-05-27T19:59:29-07:00
MatR: Bruce Springsteen and Friends: Blowin’ Down This Road,/2020/05/27/matr-bruce-springsteen-and-friends-blowin-down-this-road/,2020-05-27T05:00:00-07:00,2020-05-27T05:19:04-07:00
MatR: Bruce Springsteen and Jerry Lee Lewis: Whole Lotta Shakin’ Goin’ On,/2020/05/15/matr-bruce-springsteen-and-jerry-lee-lewis-whol/,2020-05-15T05:00:00-07:00,2020-05-15T05:11:24-07:00
MatR: The Rolling Stones and Bruce Springsteen: Start Me Up,/2020/05/12/matr-the-rolling-stones-and-bruce-springsteen-start-me-up/,2020-05-12T05:00:00-07:00,2020-05-09T14:24:25-07:00
"MatR: Roy Orbison, Bruce Springsteen and Friends: Blue Bayou",/2020/05/05/matr-roy-orbison-bruce-springsteen-and-friends-blue-bayou/,2020-05-05T05:00:00-07:00,2020-05-04T16:17:27-07:00
MatR: Billy Joel and Bruce Springsteen: Movin’ Out (Anthony’s Song),/2020/04/27/matr-billy-joel-and-bruce-springsteen-movin-out-anthonys-song/,2020-04-27T05:00:00-07:00,2020-04-26T20:22:42-07:00
MatR: Bruce Springsteen and Joe Ely: Settle for Love,/2020/04/22/matr-bruce-springsteen-and-joe-ely-settle-for-love/,2020-04-22T05:00:00-07:00,2020-04-21T20:41:15-07:00
"Cover Me, Melissa Etheridge: Thunder Road",/2020/04/20/cover-me-melissa-etheridge-thunder-road/,2020-04-20T05:00:00-07:00,2020-04-20T05:07:06-07:00
MatR: Stewart Francke and Bruce Springsteen: Summer Solider (Holler If Ya Hear Me),/2020/04/17/matr-stewart-francke-and-bruce-springsteen-summ/,2020-04-17T05:00:00-07:00,2020-04-17T05:15:45-07:00
MatR: Stray Cats and Bruce Springsteen: Twenty Flight Rock,/2020/04/13/matr-stray-cats-and-bruce-springsteen-twenty-flight-rock/,2020-04-13T05:00:00-07:00,2020-04-13T08:30:43-07:00
MatR: Nils Lofgren and Bruce Springsteen: Lean on Me,/2020/04/03/matr-bruce-springsteen-and-nils-lofgren-lean-on-me/,2020-04-03T13:39:00-07:00,2020-04-03T15:21:50-07:00
MatR: Bruce Springsteen and Patti Scialfa: It Takes Two,/2020/04/03/matr-bruce-springsteen-and-patti-scialfa-it-takes-two/,2020-04-03T05:00:00-07:00,2020-12-22T05:53:28-08:00
MatR: Bruce Springsteen and Arcade Fire: Keep the Car Running,/2020/04/01/matr-bruce-springsteen-and-arcade-fire-keep-the-car-running/,2020-04-01T05:00:00-07:00,2020-03-31T08:09:10-07:00
MatR: Patti Scialfa and Bruce Springsteen: Tell Him,/2020/03/22/matr-patti-scialfa-and-bruce-springsteen-tell-him/,2020-03-22T05:00:00-07:00,2020-03-14T13:11:54-07:00
MatR: Billy Joel and Bruce Springsteen: A Matter of Trust,/2020/03/17/matr-billy-joel-and-bruce-springsteen-a-matter-of-trust/,2020-03-17T05:00:00-07:00,2020-03-17T05:11:30-07:00
MatR: Garland Jeffreys and Bruce Springsteen: Hail Hail Rock ‘n’ Roll,/2020/03/13/matr-garland-jeffreys-and-bruce-springsteen-hail-hail-rock-n-roll/,2020-03-13T05:00:00-07:00,2020-03-13T06:32:26-07:00
MatR: Patti Scialfa and Bruce Springsteen: Loves Glory,/2020/03/08/matr-patti-scialfa-and-bruce-springsteen-loves-glory/,2020-03-08T05:00:00-07:00,2020-03-08T06:43:35-07:00
"MatR: Nicky Addeo, Bruce Springsteen and Friends: Crying in the Chapel",/2020/02/22/matr-nicky-addeo-bruce-springsteen-and-friends-crying-in-the-chapel/,2020-02-22T05:00:00-08:00,2020-02-25T20:16:54-08:00
MatR: Bruce Springsteen and Martha Reeves: Heat Wave,/2020/02/18/matr-bruce-springsteen-and-martha-reeves-heat-wave/,2020-02-18T05:00:00-08:00,2020-12-20T10:38:29-08:00
"Cover Me: I’m Bad, I’m Nationwide",/2020/02/17/cover-me-im-bad-im-nationwide/,2020-02-17T05:00:00-08:00,2020-02-17T05:31:38-08:00
"Cover Me, Southside Johnny and Ronnie Spector: You Mean So Much to Me",/2020/02/16/cover-me-southside-johnny-and-ronnie-spector-you-mean-so-much-to-me/,2020-02-16T05:00:00-08:00,2020-02-16T05:11:22-08:00
"MatR: Bruce Springsteen and Garland Jeffreys, 96 Tears",/2020/02/15/matr-bruce-springsteen-and-garland-jeffreys-96-tears/,2020-02-15T05:00:00-08:00,2020-12-20T10:36:20-08:00
"MatR: Billy Joel, Bruce Springsteen and the E Street Band: Only the Good Die Young",/2020/02/10/matr-billy-joel-bruce-springsteen-and-the-e-str/,2020-02-10T05:00:00-08:00,2020-02-10T05:07:50-08:00
"MatR: Patti Scialfa (and Bruce Springsteen), Play Around",/2020/02/06/matr-patti-scialfa-and-bruce-springsteen-play-around/,2020-02-06T05:00:00-08:00,2020-02-06T05:44:05-08:00
MatR: Dropkick Murphys and Bruce Springsteen: Peg o’ My Heart,/2020/02/03/matr-dropkick-murphys-and-bruce-springsteen-peg-o-my-heart/,2020-02-03T05:00:00-08:00,2020-12-20T10:32:33-08:00
MatR: Bob Seger and Bruce Springsteen: Old Time Rock and Roll,/2020/02/01/matr-bob-seger-and-bruce-springsteen-old-time-rock-and-roll/,2020-02-01T05:00:00-08:00,2020-01-26T13:43:49-08:00
"MatR: Bob Dylan, Bruce Springsteen, and Neil Young: Rainy Day Women #12 & 35",/2020/01/29/matr-bob-dylan-bruce-springsteen-and-neil-young/,2020-01-29T05:00:00-08:00,2020-01-29T04:36:51-08:00
MatR: Steve Earle and Bruce Springsteen: Dead Flowers,/2020/01/25/matr-steve-earle-and-bruce-springsteen-dead-flowers/,2020-01-25T05:00:00-08:00,2021-12-19T16:42:04-08:00
MatR: Mike Ness and Bruce Springsteen: Misery Loves Company,/2020/01/22/matr-mike-ness-and-bruce-springsteen-misery-loves-company/,2020-01-22T05:00:00-08:00,2020-01-22T06:02:52-08:00
MatR: Bruce Springsteen and Gary U.S. Bonds: Soul Deep,/2020/01/17/matr-bruce-springsteen-and-gary-u-s-bonds-soul-deep/,2020-01-17T05:00:00-08:00,2020-12-19T05:21:33-08:00
MatR: Bruce Springsteen and Beaver Brown: Do You Want to Dance,/2020/01/06/matr-bruce-springsteen-and-beaver-brown-do-you-want-to-dance/,2020-01-06T05:00:00-08:00,2020-01-06T05:09:55-08:00
MatR: Bruce Springsteen and Sonny Kenn & The Wild Ideas: Rip It Up,/2019/12/31/matr-bruce-springsteen-and-sonny-kenn-the-wild-ideas-rip-it-up/,2019-12-31T05:00:00-08:00,2019-12-29T11:20:43-08:00
"MatR: Bruce Springsteen and Roger McGuinn, Mr. Tambourine Man",/2019/12/28/matr-bruce-springsteen-and-roger-mcguinn-mr-tambourine-man/,2019-12-28T05:00:00-08:00,2021-12-19T16:21:36-08:00
"MatR: Garland Jeffreys and Bruce Springsteen, R.O.C.K.",/2019/12/04/matr-garland-jeffreys-and-bruce-springsteen-r-o-c-k/,2019-12-04T04:51:00-08:00,2023-01-01T12:33:30-08:00
"MatR: Dr. John and Bruce Springsteen: Right Place, Wrong Time",/2019/12/02/matr-dr-john-and-bruce-springsteen-right-place-wrong-time/,2019-12-02T05:00:00-08:00,2019-12-01T18:28:12-08:00
"MatR: Bruce Springsteen and Jah Love, One Love/People Get Ready",/2019/11/28/matr-bruce-springsteen-and-jah-love-one-love-people-get-ready/,2019-11-28T05:00:00-08:00,2019-11-28T05:37:20-08:00
"MatR: Bruce Springsteen and Beaver Brown, Money (That’s What I Want)",/2019/11/26/matr-bruce-springsteen-and-beaver-brown-money-thats-what-i-want/,2019-11-26T05:00:00-08:00,2021-01-07T20:31:41-08:00
MatR: Bruce Springsteen and Southside Johnny: Soothe Me,/2022/10/03/matr-bruce-springsteen-and-southside-johnny-soothe-me/,2022-10-03T05:00:00-07:00,2022-10-02T19:10:57-07:00
MatR/RotD: Bruce Springsteen and Jimmy Fallon: Gov. Christie Traffic Jam,/2022/08/31/matr-rotd-bruce-springsteen-and-jimmy-fallon-go/,2022-08-31T05:00:00-07:00,2022-08-31T06:43:15-07:00
MatR: The Rolling Stones and Bruce Springsteen: Tumbling Dice,/2022/08/17/matr-the-rolling-stones-and-bruce-springsteen-tumbling-dice/,2022-08-17T05:00:00-07:00,2023-01-03T08:37:17-08:00
"MatR: Bruce Springsteen, Jerry Lee Lewis, and Joe Ely: Great Balls of Fire",/2022/08/10/matr-bruce-springsteen-jerry-lee-lewis-and-joe-/,2022-08-10T05:00:00-07:00,2024-01-03T15:59:29-08:00
MatR: John Mellencamp and Bruce Springsteen: A Life Full of Rain,/2022/07/31/matr-john-mellencamp-and-bruce-springsteen-a-life-full-of-rain/,2022-07-31T05:00:00-07:00,2024-01-03T15:53:47-08:00
"MatR: John Eddie, Bruce Springsteen, and Friends: Hey Tonight",/2022/07/21/matr-john-eddie-bruce-springsteen-and-friends-hey-tonight/,2022-07-21T05:00:00-07:00,2022-07-21T06:44:39-07:00
"MatR: Roy Orbison, Bruce Springsteen and Friends: Ooby Dooby",/2022/07/11/matr-roy-orbison-bruce-springsteen-and-friends-ooby-dooby/,2022-07-11T05:00:00-07:00,2024-01-03T15:50:55-08:00
RotD/MatR: Joe Grushecky and Bruce Springsteen: Homestead,/2022/06/25/rotd-matr-joe-grushecky-and-bruce-springsteen-homestead/,2022-06-25T05:00:00-07:00,2024-01-03T15:43:54-08:00
MatR: Bleachers and Bruce Springsteen: Chinatown,/2022/05/24/matr-bleachers-and-bruce-springsteen-chinatown/,2022-05-24T05:00:00-07:00,2024-01-03T15:25:20-08:00
MatR: Bruce Springsteen and the Asbury Park All-Star Revue: It Ain’t the Meat (It’s the Motion),/2022/05/16/matr-bruce-springsteen-and-the-asbury-park-all-/,2022-05-16T05:00:00-07:00,2022-05-15T22:08:09-07:00
MatR: Little Steven and Bruce Springsteen: Can I Get a Witness,/2019/11/16/matr-little-steven-and-bruce-springsteen-can-i-get-a-witness/,2019-11-16T05:00:00-08:00,2019-11-15T12:04:54-08:00
"MatR: Bruce Springsteen and Cats on a Smooth Surface: Rock Baby, Rock It",/2019/11/12/matr-bruce-springsteen-and-cats-on-a-smooth-sur/,2019-11-12T05:00:00-08:00,2019-11-12T06:20:56-08:00
"MatR: John Fogerty and Bruce Springsteen, Fortunate Son",/2019/11/09/matr-john-fogerty-and-bruce-springsteen-fortunate-son/,2019-11-09T05:00:00-08:00,2023-01-01T12:13:15-08:00
"MatR: Alejandro Escovedo and Bruce Springsteen, Faith",/2019/11/04/matr-alejandro-escovedo-and-bruce-springsteen-faith/,2019-11-04T03:54:00-08:00,2019-11-04T03:53:30-08:00
MatR: Bruce Springsteen and The Shots: Funky Broadway,/2019/10/28/matr-bruce-springsteen-and-the-shots-funky-broadway/,2019-10-28T05:00:00-07:00,2019-10-25T14:51:06-07:00
"MatR: Little Steven and Bruce Springsteen, Native American",/2019/10/25/matr-little-steven-and-bruce-springsteen-native-american/,2019-10-25T05:00:00-07:00,2024-01-02T09:26:43-08:00
"MatR: Roy Orbison and Bruce Springsteen, Only the Lonely (Know the Way I Feel)",/2019/10/20/matr-roy-orbison-and-bruce-springsteen-only-the/,2019-10-20T05:00:00-07:00,2019-10-20T06:02:22-07:00
"MatR: Soul Asylum and Bruce Springsteen, The Tracks of My Tears",/2019/10/16/matr-soul-asylum-and-bruce-springsteen-the-tracks-of-my-tears/,2019-10-16T05:00:00-07:00,2020-12-16T07:20:04-08:00
"MatR: Joe Grushecky, Bill Deasy and Bruce Springsteen, Broken Wheel",/2019/09/29/matr-joe-grushecky-bill-deasy-and-bruce-springsteen-broken-wheel/,2019-09-29T05:00:00-07:00,2019-09-29T05:27:03-07:00
"MatR: Bruce Springsteen and Bruce Hornsby, You Sexy Thing",/2019/09/22/matr-bruce-springsteen-and-bruce-hornsby-you-sexy-thing/,2019-09-22T05:00:00-07:00,2020-12-15T08:12:33-08:00
"MatR: Stevie Wonder and Bruce Springsteen, Uptight (Everything’s Alright)",/2019/09/18/matr-stevie-wonder-and-bruce-springsteen-uptigh/,2019-09-18T05:00:00-07:00,2019-09-18T06:11:50-07:00
"MatR: Joe Grushecky and Bruce Springsteen, Gimme Shelter",/2019/09/09/matr-joe-grushecky-and-bruce-springsteen-gimme-shelter/,2019-09-09T04:30:00-07:00,2023-01-01T11:20:32-08:00
"MatR: Bruce Springsteen and Jimmy Fallon, Whip My Hair",/2019/09/05/matr-bruce-springsteen-and-jimmy-fallon-whip-my-hair/,2019-09-05T05:00:00-07:00,2020-10-31T05:14:24-07:00
"MatR: Bob Dylan and Bruce Springsteen, Forever Young",/2019/09/01/matr-bob-dylan-and-bruce-springsteen-forever-young/,2019-09-01T05:00:00-07:00,2020-06-29T19:12:31-07:00
"MatR: Gary U.S. Bonds and Bruce Springsteen, Jole Blon",/2019/08/29/matr-gary-u-s-bonds-and-bruce-springsteen-jole-blon/,2019-08-29T05:00:00-07:00,2024-01-02T09:08:03-08:00
"MatR: Ronnie Spector and The E Street Band, Say Goodbye to Hollywood",/2019/08/27/matr-ronnie-spector-and-the-e-street-band-say-goodbye-to-hollywood/,2019-08-27T05:00:00-07:00,2021-12-18T16:26:49-08:00
"MatR: Roy Orbison and Bruce Springsteen, Oh, Pretty Woman",/2019/08/25/matr-roy-orbison-and-bruce-springsteen-oh-pretty-woman/,2019-08-25T05:00:00-07:00,2024-01-02T09:04:25-08:00
"MatR: Jesse Malin and Bruce Springsteen, Broken Radio",/2019/08/17/matr-jesse-malin-and-bruce-springsteen-broken-radio/,2019-08-17T05:00:00-07:00,2021-06-11T18:09:53-07:00
"MatR: Bruce Hornsby and Bruce Springsteen, The End of the Innocence",/2019/08/16/matr-bruce-hornsby-and-bruce-springsteen-the-end-of-the-innocence/,2019-08-16T05:00:00-07:00,2024-01-02T09:01:39-08:00
Cover Me: (Get Your Kicks On) Route 66,/2019/08/15/cover-me-get-your-kicks-on-route-66/,2019-08-15T05:00:00-07:00,2019-08-14T22:57:21-07:00
"MatR: The Bruce Springsteen Band and Southside Johnny, Ain’t That Peculiar",/2019/08/12/matr-the-bruce-springsteen-band-and-southside-j/,2019-08-12T05:00:00-07:00,2019-08-11T21:20:24-07:00
"MatR: Joe Grushecky and Bruce Springsteen, Junior’s Bar",/2019/08/11/matr-joe-grushecky-and-bruce-springsteen-juniors-bar/,2019-08-11T05:00:00-07:00,2023-01-01T11:09:37-08:00
